{
  "schema_version": 1,
  "catalog_schema_id": "codex-model-catalog/0.144.5-v1",
  "supported_codex_version": "0.144.5",
  "model": "gpt-5.6-sol",
  "source_catalog_sha256": "b312e55d66ef9da1ed07a038c8d610c77b0d3c30a09a5932bae11179fd812b77",
  "source_normalized_sha256": "a678f0497f84fe926476bc2e0f8f760c6a8fd8156de6c690e43c2fe245207b9a",
  "source_sol_sha256": "446544e485dd43aafa6548c1e27b753fcfeba7d70633a3ff93fb81ee5ee1679c",
  "preserved_sol_sha256": "6f20f03be5fbe6e59cd4e251855fa0cb20beababa1f1b54fe2d02178d7e21188",
  "output_catalog_sha256": "eceabc60cee218fc5a4bd2042ecccd9330be7986a8095ed26905779a15687081",
  "output_sol_sha256": "c3c7185b0343dfa59cee33943f6febfcb0a0e8b38d4a2588cbc4bd86b4032ab5",
  "output_model_count": 1,
  "changed_policy_fields": [
    "context_window",
    "effective_context_window_percent",
    "max_context_window"
  ],
  "official_sol_limits": {
    "slug": "gpt-5.6-sol",
    "total_context_window": 1050000,
    "max_input": 922000,
    "max_output": 128000
  },
  "overlay_policy": {
    "context_window": 1050000,
    "max_context_window": 1050000,
    "effective_context_window_percent": 96,
    "auto_compact_token_limit": null
  }
}
